{
  "report_version": "1.0.0",
  "generated_at": "2025-10-30T20:26:27Z",
  "agent": {
    "name": "inspecta",
    "version": "0.1.0"
  },
  "device": {
    "vendor": "unknown",
    "model": "unknown",
    "serial": null
  },
  "mode": "quick",
  "profile": "default",
  "summary": {
    "overall_score": 76,
    "grade": "Good",
    "recommendation": "Profile: default"
  },
  "scores": {
    "storage": 50,
    "battery": 80,
    "memory": 90,
    "cpu_thermal": 85
  },
  "tests": [
    {
      "name": "smartctl_sda",
      "status": "error",
      "error": "smartctl not found. Install with: sudo apt install smartmontools"
    },
    {
      "name": "smartctl_sdb",
      "status": "error",
      "error": "smartctl not found. Install with: sudo apt install smartmontools"
    }
  ],
  "artifacts": [
    "artifacts/agent.log",
    "artifacts/memtest.log",
    "artifacts/sensors.csv"
  ],
  "evidence": {
    "manifest_sha256": null,
    "signed": false
  }
}